{
  "$schema": "https://json-schema.org/draft/2020-12/schema",
  "$id": "https://github.com/ymatrix1/easy-piano/content/schema/song.schema.json",
  "title": "Easy Piano song",
  "description": "Editor help only; `content lint` is the source of truth (bar lengths, notation, licenses).",
  "type": "object",
  "required": [
    "id",
    "title",
    "composer",
    "arranger",
    "source",
    "license",
    "composition_license",
    "bpm",
    "time",
    "key",
    "bars"
  ],
  "properties": {
    "id": {
      "type": "string",
      "pattern": "^[a-z0-9]+(-[a-z0-9]+)*$"
    },
    "title": {
      "type": "string",
      "minLength": 1
    },
    "composer": {
      "type": "string",
      "minLength": 1
    },
    "arranger": {
      "type": "string",
      "minLength": 1
    },
    "source": {
      "type": "string",
      "minLength": 1,
      "description": "`original`, `generated` (needs `generator`, CC0-1.0) or a site name (needs `source_url`)."
    },
    "source_url": {
      "type": [
        "string",
        "null"
      ]
    },
    "license": {
      "enum": [
        "CC0-1.0",
        "CC-BY-4.0",
        "CC-BY-SA-4.0",
        "public-domain"
      ]
    },
    "composition_license": {
      "enum": [
        "CC0-1.0",
        "CC-BY-4.0",
        "CC-BY-SA-4.0",
        "public-domain"
      ]
    },
    "bpm": {
      "type": "number",
      "minimum": 20,
      "maximum": 300
    },
    "time": {
      "type": "string",
      "pattern": "^[0-9]+/[0-9]+$"
    },
    "key": {
      "type": "string"
    },
    "bars": {
      "type": "array",
      "minItems": 1,
      "items": {
        "type": "object",
        "additionalProperties": false,
        "properties": {
          "RH": {
            "type": "string"
          },
          "LH": {
            "type": "string"
          },
          "ACC": {
            "type": "string"
          },
          "DRUMS": {
            "type": "string"
          },
          "BASS": {
            "type": "string"
          },
          "PAD": {
            "type": "string"
          },
          "CHOIR": {
            "type": "string"
          }
        }
      }
    },
    "critical": {
      "type": "array",
      "items": {
        "type": "array",
        "items": {
          "type": "integer",
          "minimum": 0
        },
        "minItems": 2,
        "maxItems": 2
      }
    },
    "generator": {
      "type": "object",
      "required": [
        "method"
      ],
      "additionalProperties": false,
      "properties": {
        "method": {
          "enum": [
            "rules",
            "pd-variation",
            "llm",
            "magenta",
            "hand",
            "melody-model"
          ]
        },
        "tool": {
          "type": [
            "string",
            "null"
          ]
        },
        "model": {
          "type": [
            "string",
            "null"
          ]
        },
        "seed": {
          "type": [
            "integer",
            "null"
          ],
          "minimum": 0
        },
        "source_song": {
          "type": [
            "string",
            "null"
          ]
        },
        "prompt_ref": {
          "type": [
            "string",
            "null"
          ]
        }
      }
    },
    "spec_node": {
      "type": "string",
      "pattern": "^[a-z0-9-]+/[a-z0-9-]+$",
      "description": "Journey node `course/node` this song targets; lint runs the rubric."
    },
    "restricted_in": {
      "type": "array",
      "description": "Regions where the composition is still protected (D33); the app must not offer the song there before `until`.",
      "items": {
        "type": "object",
        "required": [
          "region",
          "until"
        ],
        "additionalProperties": false,
        "properties": {
          "region": {
            "type": "string",
            "pattern": "^[A-Z]{2}$"
          },
          "until": {
            "type": "string",
            "pattern": "^[0-9]{4}-[0-9]{2}-[0-9]{2}$"
          }
        }
      }
    }
  },
  "additionalProperties": false
}
