{
  "id": "new-world-largo",
  "title": "Largo (New World Symphony)",
  "composer": "Antonin Dvorak",
  "arranger": "Easy Piano contributors",
  "source": "original",
  "source_url": null,
  "license": "CC-BY-SA-4.0",
  "composition_license": "public-domain",
  "bpm": 66,
  "time": "4/4",
  "key": "C",
  "bars": [
    {
      "RH": "r:2. C4:4@1",
      "LH": "r:1"
    },
    {
      "RH": "E4:2@3 G4:2@5",
      "LH": "C3:2@5 G3:2@1"
    },
    {
      "RH": "G4:2.@5 E4:4@3",
      "LH": "C3:2@5 E3:2@3"
    },
    {
      "RH": "D4:2.@2 C4:4@1",
      "LH": "G3:2@1 D3:2@4"
    },
    {
      "RH": "E4:2@1 G4:2@3",
      "LH": "C3:2@5 G3:2@1"
    },
    {
      "RH": "A4:2@4 G4:2@3",
      "LH": "F3:2@2 E3:2@3"
    },
    {
      "RH": "E4:2.@1 G4:4@3",
      "LH": "C3:2@5 E3:2@3"
    },
    {
      "RH": "D4:2.@2 C4:4@1",
      "LH": "G3:2@1 D3:2@4"
    },
    {
      "RH": "A4:2.@2 G4:4@1",
      "LH": "F3:2@2 C3:2@5"
    },
    {
      "RH": "B4:2@3 C5:2@4",
      "LH": "G3:2@1 D3:2@4"
    },
    {
      "RH": "D5:2.@5 C5:4@4",
      "LH": "E3:2@3 G3:2@1"
    },
    {
      "RH": "B4:2.@3 G4:4@1",
      "LH": "G3:2@1 D3:2@4"
    },
    {
      "RH": "E4:2@3 G4:2@5",
      "LH": "C3:2@5 G3:2@1"
    },
    {
      "RH": "G4:2.@5 E4:4@3",
      "LH": "C3:2@5 E3:2@3"
    },
    {
      "RH": "D4:2.@2 E4:4@3",
      "LH": "G3:2@1 D3:2@4"
    },
    {
      "RH": "C4:1@1",
      "LH": "C3G3:1@51"
    }
  ],
  "critical": [
    [
      8,
      11
    ]
  ]
}