{
  "id": "i4-high-etude",
  "title": "High Etude in G",
  "composer": "Easy Piano contributors",
  "arranger": "Easy Piano contributors",
  "source": "original",
  "source_url": null,
  "license": "CC-BY-SA-4.0",
  "composition_license": "CC-BY-SA-4.0",
  "bpm": 84,
  "time": "4/4",
  "key": "G",
  "bars": [
    {
      "RH": "G4:4@1 B4:4@3 D5:2@5",
      "LH": "G2B2D3:2@531 G2B2D3:2@531"
    },
    {
      "RH": "D5:1/12@5 C5:1/12@4 B4:1/12@3 A4:1/12@2 G4:1/12@1 A4:1/12@2 B4:2@3",
      "LH": "G2B2D3:2@531 G2B2D3:2@531"
    },
    {
      "RH": "C5:1/12@4 B4:1/12@3 A4:1/12@2 B4:1/12@3 C5:1/12@4 D5:1/12@5 C5:2@4",
      "LH": "G2C3E3:2@521 G2C3E3:2@521"
    },
    {
      "RH": "B4:4@3 A4:4@2 G4:2@1",
      "LH": "G2B2D3:2@531 G2B2D3:2@531"
    },
    {
      "RH": "D4:4@1 F#4:4@3 A4:2@5",
      "LH": "A2C3D3F#3:2@5321 A2C3D3F#3:2@5321"
    },
    {
      "RH": "F#4:1/12@3 G4:1/12@4 A4:1/12@5 G4:1/12@4 F#4:1/12@3 G4:1/12@4 A4:2@5",
      "LH": "A2C3D3F#3:2@5321 A2C3D3F#3:2@5321"
    },
    {
      "RH": "G4:1/12@1 A4:1/12@2 B4:1/12@3 C5:1/12@4 D5:1/12@5 C5:1/12@4 B4:2@3",
      "LH": "G2B2D3:2@531 G2B2D3:2@531"
    },
    {
      "RH": "G4:1@1",
      "LH": "G2B2D3:1@531"
    },
    {
      "RH": "D5:1/12@1 E5:1/12@2 F#5:1/12@3 G5:1/12@4 F#5:1/12@3 E5:1/12@2 D5:2@1",
      "LH": "G2B2D3:2@531 G2B2D3:2@531"
    },
    {
      "RH": "C5:1/12@1 D5:1/12@2 E5:1/12@3 D5:1/12@2 C5:1/12@1 D5:1/12@2 E5:2@3",
      "LH": "G2C3E3:2@521 G2C3E3:2@521"
    },
    {
      "RH": "A4:4@1 C5:4@3 A4:2@1",
      "LH": "A2C3D3F#3:2@5321 A2C3D3F#3:2@5321"
    },
    {
      "RH": "D5:2@5 G4:2@1",
      "LH": "G2B2D3:2@531 G2B2D3:2@531"
    },
    {
      "RH": "D5:4@1 E5:4@2 F#5:4@3 G5:4@4",
      "LH": "G2B2D3:2@531 G2B2D3:2@531"
    },
    {
      "RH": "G5:4@5 E5:4@3 C5:2@1",
      "LH": "G2C3E3:2@521 G2C3E3:2@521"
    },
    {
      "RH": "A4:1/12@1 B4:1/12@2 C5:1/12@3 D5:4@4 C5:4@3 B4:4@2",
      "LH": "A2C3D3F#3:2@5321 A2C3D3F#3:2@5321"
    },
    {
      "RH": "G4:1@1",
      "LH": "G2B2D3:1@531"
    }
  ],
  "critical": [
    [
      8,
      14
    ]
  ]
}