{
  "id": "jingle-bells",
  "title": "Jingle Bells",
  "composer": "James Lord Pierpont",
  "arranger": "Easy Piano contributors",
  "source": "original",
  "source_url": null,
  "license": "CC-BY-SA-4.0",
  "composition_license": "public-domain",
  "bpm": 104,
  "time": "4/4",
  "key": "C",
  "bars": [
    {
      "RH": "E4:4@3 E4:4@3 E4:2@3",
      "LH": "C3:1@5",
      "ACC": "C3E3G3:2 C3E3G3:2",
      "DRUMS": "C2F#2:8 F#2:8 D2F#2:8 F#2:8 C2F#2:8 C2F#2:8 D2F#2:8 F#2:8",
      "BASS": "C2:4 G2:4 E2:4 G2:4"
    },
    {
      "RH": "E4:4@3 E4:4@3 E4:2@3",
      "LH": "C3:1@5",
      "ACC": "C3E3G3:2 C3E3G3:2",
      "DRUMS": "C2F#2:8 F#2:8 D2F#2:8 F#2:8 C2F#2:8 C2F#2:8 D2F#2:8 F#2:8",
      "BASS": "C2:4 G2:4 E2:4 G2:4"
    },
    {
      "RH": "E4:4@3 G4:4@5 C4:4.@1 D4:8@2",
      "LH": "C3:1@5",
      "ACC": "C3E3G3:2 C3E3G3:2",
      "DRUMS": "C2F#2:8 F#2:8 D2F#2:8 F#2:8 C2F#2:8 C2F#2:8 D2F#2:8 F#2:8",
      "BASS": "C2:4 G2:4 E2:4 G2:4"
    },
    {
      "RH": "E4:1@3",
      "LH": "C3:1@5",
      "ACC": "C3E3G3:2 C3E3G3:2",
      "DRUMS": "C2F#2:8 F#2:8 D2F#2:8 F#2:8 C2F#2:8 C2F#2:8 D2F#2:8 F#2:8",
      "BASS": "C2:4 G2:4 E2:4 G2:4"
    },
    {
      "RH": "F4:4@4 F4:4@4 F4:4.@4 F4:8@4",
      "LH": "F3:1@2",
      "ACC": "C3F3A3:2 C3F3A3:2",
      "DRUMS": "C2F#2:8 F#2:8 D2F#2:8 F#2:8 C2F#2:8 C2F#2:8 D2F#2:8 F#2:8",
      "BASS": "F1:4 C2:4 A1:4 C2:4"
    },
    {
      "RH": "F4:4@4 E4:4@3 E4:4@3 E4:8@3 E4:8@3",
      "LH": "C3:1@5",
      "ACC": "C3E3G3:2 C3E3G3:2",
      "DRUMS": "C2F#2:8 F#2:8 D2F#2:8 F#2:8 C2F#2:8 C2F#2:8 D2F#2:8 F#2:8",
      "BASS": "C2:4 G2:4 E2:4 G2:4"
    },
    {
      "RH": "E4:4@3 D4:4@2 D4:4@2 E4:4@3",
      "LH": "G3:1@1",
      "ACC": "B2D3G3:2 B2D3G3:2",
      "DRUMS": "C2F#2:8 F#2:8 D2F#2:8 F#2:8 C2F#2:8 C2F#2:8 D2F#2:8 F#2:8",
      "BASS": "G1:4 D2:4 B1:4 D2:4"
    },
    {
      "RH": "D4:2@2 G4:2@5",
      "LH": "G3:1@1",
      "ACC": "B2D3G3:2 B2D3G3:2",
      "DRUMS": "C2F#2:8 F#2:8 D2F#2:8 F#2:8 C2F#2:8 C2F#2:8 D2F#2:8 F#2:8",
      "BASS": "G1:4 D2:4 B1:4 D2:4"
    },
    {
      "RH": "E4:4@3 E4:4@3 E4:2@3",
      "LH": "C3:1@5",
      "ACC": "C3E3G3:2 C3E3G3:2",
      "DRUMS": "C2F#2:8 F#2:8 D2F#2:8 F#2:8 C2F#2:8 C2F#2:8 D2F#2:8 F#2:8",
      "BASS": "C2:4 G2:4 E2:4 G2:4"
    },
    {
      "RH": "E4:4@3 E4:4@3 E4:2@3",
      "LH": "C3:1@5",
      "ACC": "C3E3G3:2 C3E3G3:2",
      "DRUMS": "C2F#2:8 F#2:8 D2F#2:8 F#2:8 C2F#2:8 C2F#2:8 D2F#2:8 F#2:8",
      "BASS": "C2:4 G2:4 E2:4 G2:4"
    },
    {
      "RH": "E4:4@3 G4:4@5 C4:4.@1 D4:8@2",
      "LH": "C3:1@5",
      "ACC": "C3E3G3:2 C3E3G3:2",
      "DRUMS": "C2F#2:8 F#2:8 D2F#2:8 F#2:8 C2F#2:8 C2F#2:8 D2F#2:8 F#2:8",
      "BASS": "C2:4 G2:4 E2:4 G2:4"
    },
    {
      "RH": "E4:1@3",
      "LH": "C3:1@5",
      "ACC": "C3E3G3:2 C3E3G3:2",
      "DRUMS": "C2F#2:8 F#2:8 D2F#2:8 F#2:8 C2F#2:8 C2F#2:8 D2F#2:8 F#2:8",
      "BASS": "C2:4 G2:4 E2:4 G2:4"
    },
    {
      "RH": "F4:4@4 F4:4@4 F4:4.@4 F4:8@4",
      "LH": "F3:1@2",
      "ACC": "C3F3A3:2 C3F3A3:2",
      "DRUMS": "C2F#2:8 F#2:8 D2F#2:8 F#2:8 C2F#2:8 C2F#2:8 D2F#2:8 F#2:8",
      "BASS": "F1:4 C2:4 A1:4 C2:4"
    },
    {
      "RH": "F4:4@4 E4:4@3 E4:4@3 E4:8@3 E4:8@3",
      "LH": "C3:1@5",
      "ACC": "C3E3G3:2 C3E3G3:2",
      "DRUMS": "C2F#2:8 F#2:8 D2F#2:8 F#2:8 C2F#2:8 C2F#2:8 D2F#2:8 F#2:8",
      "BASS": "C2:4 G2:4 E2:4 G2:4"
    },
    {
      "RH": "G4:4@5 G4:4@5 F4:4@4 D4:4@2",
      "LH": "G3:1@1",
      "ACC": "B2D3G3:2 B2D3G3:2",
      "DRUMS": "C2F#2:8 F#2:8 D2F#2:8 F#2:8 C2F#2:8 C2F#2:8 D2F#2:8 F#2:8",
      "BASS": "G1:4 D2:4 B1:4 D2:4"
    },
    {
      "RH": "C4:1@1",
      "LH": "C3:1@5",
      "ACC": "C3E3G3:1",
      "DRUMS": "C2C#3:1",
      "BASS": "C2:1"
    }
  ],
  "critical": [
    [
      0,
      8
    ],
    [
      8,
      16
    ]
  ]
}
