{
  "id": "e1-hands-drill",
  "title": "Two Hands Meet",
  "composer": "Easy Piano contributors",
  "arranger": "Easy Piano contributors",
  "source": "original",
  "source_url": null,
  "license": "CC-BY-SA-4.0",
  "composition_license": "CC-BY-SA-4.0",
  "bpm": 72,
  "time": "4/4",
  "key": "C",
  "bars": [
    {
      "RH": "E4:4@3 D4:4@2 C4:2@1",
      "LH": "C3:1@5"
    },
    {
      "RH": "E4:4@3 F4:4@4 G4:2@5",
      "LH": "C3:1@5"
    },
    {
      "RH": "F4:4@4 E4:4@3 D4:2@2",
      "LH": "G3:1@1"
    },
    {
      "RH": "E4:2@3 C4:2@1",
      "LH": "C3:1@5"
    },
    {
      "RH": "G4:4@5 F4:4@4 E4:2@3",
      "LH": "C3:2@5 E3:2@3"
    },
    {
      "RH": "F4:4@4 E4:4@3 D4:2@2",
      "LH": "G3:2@1 F3:2@2"
    },
    {
      "RH": "E4:4@3 D4:4@2 D4:2@2",
      "LH": "G3:1@1"
    },
    {
      "RH": "C4:1@1",
      "LH": "C3:1@5"
    }
  ],
  "critical": [
    [
      0,
      4
    ]
  ]
}
