{
  "id": "cs2-top-note-drill",
  "title": "Melody on Top",
  "composer": "Easy Piano contributors",
  "arranger": "Easy Piano contributors",
  "source": "original",
  "source_url": null,
  "license": "CC-BY-SA-4.0",
  "composition_license": "CC-BY-SA-4.0",
  "bpm": 80,
  "time": "4/4",
  "key": "C",
  "bars": [
    {
      "RH": "C4E4G4:4@135 E4G4C5:4@135 C4E4G4:2@135",
      "LH": "C3:2@5 G3:2@1",
      "PAD": "G3C4E4:1"
    },
    {
      "RH": "C4E4A4:4@135 E4A4C5:4@135 C4E4A4:2@135",
      "LH": "A2:2@5 E3:2@1",
      "PAD": "A3C4E4:1"
    },
    {
      "RH": "C4F4A4:4@135 F4A4C5:4@135 C4F4A4:2@135",
      "LH": "F2:2@5 C3:2@1",
      "PAD": "A3C4F4:1"
    },
    {
      "RH": "B3D4G4:4@135 D4G4B4:4@135 B3D4G4:2@135",
      "LH": "G2:2@5 D3:2@1",
      "PAD": "G3B3D4:1"
    },
    {
      "RH": "E4G4C5:4@135 C4E4G4:4@135 E4G4C5:2@135",
      "LH": "C3:2@5 G3:2@1",
      "PAD": "G3C4E4:1"
    },
    {
      "RH": "E4A4C5:4@135 C4E4A4:4@135 E4A4C5:2@135",
      "LH": "A2:2@5 E3:2@1",
      "PAD": "A3C4E4:1"
    },
    {
      "RH": "F4A4C5:4@135 C4F4A4:4@135 F4A4C5:2@135",
      "LH": "F2:2@5 C3:2@1",
      "PAD": "A3C4F4:1"
    },
    {
      "RH": "D4G4B4:4@135 B3D4G4:4@135 D4G4B4:2@135",
      "LH": "G2:2@5 D3:2@1",
      "PAD": "G3B3D4:1"
    },
    {
      "RH": "C4F4A4:2@135 F4A4C5:2@135",
      "LH": "F2:2@5 C3:2@1",
      "PAD": "A3C4F4:1"
    },
    {
      "RH": "C4E4G4:2@135 E4G4C5:2@135",
      "LH": "C3:2@5 G3:2@1",
      "PAD": "G3C4E4:1"
    },
    {
      "RH": "B3D4G4:2@135 D4G4B4:2@135",
      "LH": "G2:2@5 D3:2@1",
      "PAD": "G3B3D4:1"
    },
    {
      "RH": "E4G4C5:1@135",
      "LH": "C3:1@5",
      "PAD": "G3C4E4:1"
    }
  ],
  "critical": [
    [
      4,
      7
    ]
  ]
}