{
  "id": "scarborough-fair",
  "title": "Scarborough Fair",
  "composer": "Traditional",
  "arranger": "Easy Piano contributors",
  "source": "original",
  "source_url": null,
  "license": "CC-BY-SA-4.0",
  "composition_license": "public-domain",
  "bpm": 84,
  "time": "3/4",
  "key": "Am",
  "bars": [
    {
      "RH": "A4:4@1 A4:4@1 E5:4@5",
      "LH": "A2:4@5 E3A3:4@21 E3A3:4@21"
    },
    {
      "RH": "E5:2.@5",
      "LH": "A2:4@5 E3A3:4@21 E3A3:4@21"
    },
    {
      "RH": "E5:4@5 D5:4@4 C5:4@3",
      "LH": "C3:4@5 E3G3:4@31 E3G3:4@31"
    },
    {
      "RH": "B4:2.@2",
      "LH": "B2:4@5 D3G3:4@31 D3G3:4@31"
    },
    {
      "RH": "C5:4@3 D5:4@4 E5:4@5",
      "LH": "C3:4@5 E3G3:4@31 E3G3:4@31"
    },
    {
      "RH": "E5:2@5 D5:4@4",
      "LH": "A2:4@5 E3A3:4@21 E3A3:4@21"
    },
    {
      "RH": "C5:4@3 B4:4@2 A4:4@1",
      "LH": "A2:4@5 E3A3:4@21 E3A3:4@21"
    },
    {
      "RH": "A4:2.@1",
      "LH": "A2:4@5 E3A3:4@21 E3A3:4@21"
    },
    {
      "RH": "E5:2@5 E5:4@5",
      "LH": "A2:4@5 E3A3:4@21 E3A3:4@21"
    },
    {
      "RH": "E5:4@5 D5:4@4 C5:4@3",
      "LH": "C3:4@5 E3G3:4@31 E3G3:4@31"
    },
    {
      "RH": "D5:2@4 E5:4@5",
      "LH": "B2:4@5 D3G3:4@31 D3G3:4@31"
    },
    {
      "RH": "C5:2.@3",
      "LH": "C3:4@5 E3G3:4@31 E3G3:4@31"
    },
    {
      "RH": "A4:4@1 B4:4@2 C5:4@3",
      "LH": "A2:4@5 E3A3:4@21 E3A3:4@21"
    },
    {
      "RH": "D5:2@4 C5:4@3",
      "LH": "D3:4@5 F3A3:4@21 F3A3:4@21"
    },
    {
      "RH": "B4:4@2 C5:4@3 B4:4@2",
      "LH": "E3:4@5 G3B3:4@21 G3B3:4@21"
    },
    {
      "RH": "A4:2.@1",
      "LH": "A2E3A3:2.@521"
    }
  ],
  "critical": [
    [
      8,
      11
    ]
  ]
}