{
  "id": "cs2-rock-drill",
  "title": "Root and Fifth",
  "composer": "Easy Piano contributors",
  "arranger": "Easy Piano contributors",
  "source": "original",
  "source_url": null,
  "license": "CC-BY-SA-4.0",
  "composition_license": "CC-BY-SA-4.0",
  "bpm": 104,
  "time": "4/4",
  "key": "C",
  "bars": [
    {
      "RH": "E4:2@1 G4:2@3",
      "LH": "C3:8@5 G3:8@1 C3:8@5 G3:8@1 C3:8@5 G3:8@1 C3:8@5 G3:8@1",
      "DRUMS": "C2F#2:8 F#2:8 D2F#2:8 F#2:8 C2F#2:8 C2F#2:8 D2F#2:8 F#2:8"
    },
    {
      "RH": "A4:2@2 G4:2@1",
      "LH": "C3:8@5 G3:8@1 C3:8@5 G3:8@1 C3:8@5 G3:8@1 C3:8@5 G3:8@1",
      "DRUMS": "C2F#2:8 F#2:8 D2F#2:8 F#2:8 C2F#2:8 C2F#2:8 D2F#2:8 F#2:8"
    },
    {
      "RH": "A4:2@1 C5:2@3",
      "LH": "F2:8@5 C3:8@1 F2:8@5 C3:8@1 F2:8@5 C3:8@1 F2:8@5 C3:8@1",
      "DRUMS": "C2F#2:8 F#2:8 D2F#2:8 F#2:8 C2F#2:8 C2F#2:8 D2F#2:8 F#2:8"
    },
    {
      "RH": "A4:4@3 G4:4@2 F4:2@1",
      "LH": "F2:8@5 C3:8@1 F2:8@5 C3:8@1 F2:8@5 C3:8@1 F2:8@5 C3:8@1",
      "DRUMS": "C2F#2:8 F#2:8 D2F#2:8 F#2:8 D2:8 D2:8 D2:8 D2:8"
    },
    {
      "RH": "E4:2@1 G4:2@3",
      "LH": "C3:8@5 G3:8@1 C3:8@5 G3:8@1 C3:8@5 G3:8@1 C3:8@5 G3:8@1",
      "DRUMS": "C2F#2:8 F#2:8 D2F#2:8 F#2:8 C2F#2:8 C2F#2:8 D2F#2:8 F#2:8"
    },
    {
      "RH": "E4:4@3 D4:4@2 C4:2@1",
      "LH": "C3:8@5 G3:8@1 C3:8@5 G3:8@1 C3:8@5 G3:8@1 C3:8@5 G3:8@1",
      "DRUMS": "C2F#2:8 F#2:8 D2F#2:8 F#2:8 C2F#2:8 C2F#2:8 D2F#2:8 F#2:8"
    },
    {
      "RH": "D4:2@1 G4:2@4",
      "LH": "G2:8@5 D3:8@1 G2:8@5 D3:8@1 G2:8@5 D3:8@1 G2:8@5 D3:8@1",
      "DRUMS": "C2F#2:8 F#2:8 D2F#2:8 F#2:8 C2F#2:8 C2F#2:8 D2F#2:8 F#2:8"
    },
    {
      "RH": "B4:2@3 G4:2@1",
      "LH": "G2:8@5 D3:8@1 G2:8@5 D3:8@1 G2:8@5 D3:8@1 G2:8@5 D3:8@1",
      "DRUMS": "C2F#2:8 F#2:8 D2F#2:8 F#2:8 D2:8 D2:8 D2:8 D2:8"
    },
    {
      "RH": "C5:4@4 B4:4@3 C5:4@4 G4:4@1",
      "LH": "C3:8@5 G3:8@1 C3:8@5 G3:8@1 C3:8@5 G3:8@1 C3:8@5 G3:8@1",
      "DRUMS": "C2F#2:8 F#2:8 D2F#2:8 F#2:8 C2F#2:8 C2F#2:8 D2F#2:8 F#2:8"
    },
    {
      "RH": "A4:2@1 C5:2@3",
      "LH": "F2:8@5 C3:8@1 F2:8@5 C3:8@1 F2:8@5 C3:8@1 F2:8@5 C3:8@1",
      "DRUMS": "C2F#2:8 F#2:8 D2F#2:8 F#2:8 C2F#2:8 C2F#2:8 D2F#2:8 F#2:8"
    },
    {
      "RH": "B4:4@3 A4:4@2 G4:2@1",
      "LH": "G2:8@5 D3:8@1 G2:8@5 D3:8@1 G2:8@5 D3:8@1 G2:8@5 D3:8@1",
      "DRUMS": "C2F#2:8 F#2:8 D2F#2:8 F#2:8 C2F#2:8 C2F#2:8 D2F#2:8 F#2:8"
    },
    {
      "RH": "C5:1@1",
      "LH": "C3:1@5",
      "DRUMS": "C2C#3:1"
    }
  ],
  "critical": [
    [
      8,
      11
    ]
  ]
}