{
  "id": "c1-fifths-drill",
  "title": "Fifths and Sixths Drill",
  "composer": "Easy Piano contributors",
  "arranger": "Easy Piano contributors",
  "source": "original",
  "source_url": null,
  "license": "CC-BY-SA-4.0",
  "composition_license": "CC-BY-SA-4.0",
  "bpm": 72,
  "time": "4/4",
  "key": "C",
  "bars": [
    {
      "RH": "E4:2@3 G4:2@5",
      "LH": "C3G3:1@51"
    },
    {
      "RH": "F4:2@4 E4:2@3",
      "LH": "F2C3:1@51"
    },
    {
      "RH": "D4:2@2 G4:2@5",
      "LH": "G2D3:1@51"
    },
    {
      "RH": "E4:1@3",
      "LH": "C3G3:1@51"
    },
    {
      "RH": "G4:4@5 F4:4@4 E4:4@3 D4:4@2",
      "LH": "C3G3:2@51 C3G3:2@51"
    },
    {
      "RH": "E4:4@3 F4:4@4 G4:2@5",
      "LH": "F2C3:2@51 F2D3:2@51"
    },
    {
      "RH": "F4:4@4 E4:4@3 D4:2@2",
      "LH": "G2D3:2@51 G2E3:2@51"
    },
    {
      "RH": "C4:1@1",
      "LH": "C3G3:1@51"
    }
  ],
  "critical": [
    [
      4,
      7
    ]
  ]
}