{
  "id": "ls1-beat-drill",
  "title": "One, Two, Three, Four",
  "composer": "Easy Piano contributors",
  "arranger": "Easy Piano contributors",
  "source": "original",
  "source_url": null,
  "license": "CC-BY-SA-4.0",
  "composition_license": "CC-BY-SA-4.0",
  "bpm": 72,
  "time": "4/4",
  "key": "C",
  "bars": [
    {
      "RH": "{chord:\"C\"} E4:4@3 E4:4@3 {chord:\"C\"} G4:4@5 G4:4@5",
      "LH": "C3E3G3:2@531 C3E3G3:2@531",
      "DRUMS": "C2F#2:8 F#2:8 D2F#2:8 F#2:8 C2F#2:8 C2F#2:8 D2F#2:8 F#2:8",
      "BASS": "C2:4 G2:4 C2:4 G2:4"
    },
    {
      "RH": "{chord:\"F\"} F4:4@4 E4:4@3 {chord:\"F\"} F4:4@4 G4:4@5",
      "LH": "C3F3A3:2@521 C3F3A3:2@521",
      "DRUMS": "C2F#2:8 F#2:8 D2F#2:8 F#2:8 C2F#2:8 C2F#2:8 D2F#2:8 F#2:8",
      "BASS": "F1:4 C2:4 F1:4 C2:4"
    },
    {
      "RH": "{chord:\"G7\"} D4:4@2 F4:4@4 {chord:\"G7\"} G4:4@5 F4:4@4",
      "LH": "B2F3G3:2@521 B2F3G3:2@521",
      "DRUMS": "C2F#2:8 F#2:8 D2F#2:8 F#2:8 C2F#2:8 C2F#2:8 D2F#2:8 F#2:8",
      "BASS": "G1:4 D2:4 G1:4 D2:4"
    },
    {
      "RH": "{chord:\"C\"} E4:4@3 D4:4@2 {chord:\"C\"} C4:2@1",
      "LH": "C3E3G3:2@531 C3E3G3:2@531",
      "DRUMS": "C2F#2:8 F#2:8 D2F#2:8 F#2:8 C2F#2:8 C2F#2:8 D2F#2:8 F#2:8",
      "BASS": "C2:4 G2:4 C2:4 G2:4"
    },
    {
      "RH": "{chord:\"C\"} E4:4@3 {chord:\"C\"} E4:4@3 {chord:\"C\"} G4:4@5 {chord:\"C\"} G4:4@5",
      "LH": "C3E3G3:4@531 C3E3G3:4@531 C3E3G3:4@531 C3E3G3:4@531",
      "DRUMS": "C2F#2:8 F#2:8 D2F#2:8 F#2:8 C2F#2:8 C2F#2:8 D2F#2:8 F#2:8",
      "BASS": "C2:4 C2:4 C2:4 C2:4"
    },
    {
      "RH": "{chord:\"F\"} F4:4@4 {chord:\"F\"} F4:4@4 {chord:\"F\"} G4:4@5 {chord:\"F\"} E4:4@3",
      "LH": "C3F3A3:4@521 C3F3A3:4@521 C3F3A3:4@521 C3F3A3:4@521",
      "DRUMS": "C2F#2:8 F#2:8 D2F#2:8 F#2:8 C2F#2:8 C2F#2:8 D2F#2:8 F#2:8",
      "BASS": "F1:4 F1:4 F1:4 F1:4"
    },
    {
      "RH": "{chord:\"G7\"} D4:4@2 {chord:\"G7\"} F4:4@4 {chord:\"G7\"} G4:4@5 {chord:\"G7\"} F4:4@4",
      "LH": "B2F3G3:4@521 B2F3G3:4@521 B2F3G3:4@521 B2F3G3:4@521",
      "DRUMS": "C2F#2:8 F#2:8 D2F#2:8 F#2:8 C2F#2:8 C2F#2:8 D2F#2:8 F#2:8",
      "BASS": "G1:4 G1:4 G1:4 G1:4"
    },
    {
      "RH": "{chord:\"C\"} C4:1@1",
      "LH": "C3E3G3:1@531",
      "DRUMS": "C2C#3:1",
      "BASS": "C2:1"
    }
  ],
  "critical": [
    [
      4,
      7
    ]
  ]
}