{
  "id": "jc2-minor-251-am",
  "title": "Minor ii-V-i in A Minor",
  "composer": "Easy Piano contributors",
  "arranger": "Easy Piano contributors",
  "source": "original",
  "source_url": null,
  "license": "CC-BY-SA-4.0",
  "composition_license": "CC-BY-SA-4.0",
  "bpm": 88,
  "time": "4/4",
  "key": "Am",
  "bars": [
    {
      "RH": "D5:4@1 F5:4@3 E5:4@2 D5:4@1",
      "LH": "D3F3A3:2@531 D3F3A3:2@531",
      "DRUMS": "C2F#2:8 F#2:8 D2F#2:8 F#2:8 C2F#2:8 F#2:8 D2F#2:8 F#2:8",
      "BASS": "B1:4 F2:4 B1:4 F2:4"
    },
    {
      "RH": "G#4:8@1 B4:8@3 D5:8@5 B4:8@3 E5:4@5 D5:4@5",
      "LH": "G#2B2D3:2@531 G#2B2D3:2@531",
      "DRUMS": "C2F#2:8 F#2:8 D2F#2:8 F#2:8 C2F#2:8 C2F#2:8 D2F#2:8 F#2:8",
      "BASS": "E2:4 B1:4 E2:4 B1:4"
    },
    {
      "RH": "C5:2@1 E5:2@3",
      "LH": "C3E3A3:4.@531 C3E3A3:8@531 C3E3A3:2@531",
      "DRUMS": "C2F#2:8 F#2:8 D2F#2:8 F#2:8 C2F#2:8 F#2:8 D2F#2:8 F#2:8",
      "BASS": "A1:4 E2:4 A1:4 E2:4"
    },
    {
      "RH": "A4:1@1",
      "LH": "C3E3A3:2@531 C3E3A3:2@531",
      "DRUMS": "C2F#2:8 F#2:8 D2F#2:8 F#2:8 C2F#2:8 C2F#2:8 D2F#2:8 F#2:8",
      "BASS": "A1:4 E2:4 A1:4 E2:4"
    },
    {
      "RH": "F5:4@5 D5:4@4 A4:4@1 B4:4@2",
      "LH": "D3F3A3:2@531 D3F3A3:2@531",
      "DRUMS": "C2F#2:8 F#2:8 D2F#2:8 F#2:8 C2F#2:8 F#2:8 D2F#2:8 F#2:8",
      "BASS": "B1:4 F2:4 B1:4 F2:4"
    },
    {
      "RH": "G#4:4@1 B4:4@3 D5:4@5 E5:4@5",
      "LH": "G#2B2D3:2@531 G#2B2D3:2@531",
      "DRUMS": "C2F#2:8 F#2:8 D2F#2:8 F#2:8 C2F#2:8 C2F#2:8 D2F#2:8 F#2:8",
      "BASS": "E2:4 B1:4 E2:4 B1:4"
    },
    {
      "RH": "C5:4@3 A4:4@1 C5:4@3 E5:4@5",
      "LH": "C3E3A3:2@531 C3E3A3:2@531",
      "DRUMS": "C2F#2:8 F#2:8 D2F#2:8 F#2:8 C2F#2:8 F#2:8 D2F#2:8 F#2:8",
      "BASS": "A1:4 E2:4 A1:4 E2:4"
    },
    {
      "RH": "A4:1@1",
      "LH": "C3E3A3:4.@531 C3E3A3:8@531 C3E3A3:2@531",
      "DRUMS": "C2F#2:8 F#2:8 D2F#2:8 F#2:8 C2F#2:8 C2F#2:8 D2F#2:8 F#2:8",
      "BASS": "A1:4 E2:4 A1:4 E2:4"
    }
  ],
  "critical": [
    [
      4,
      6
    ]
  ]
}
