{
  "id": "streets-of-laredo",
  "title": "Streets of Laredo",
  "composer": "Traditional",
  "arranger": "Easy Piano contributors",
  "source": "original",
  "source_url": null,
  "license": "CC-BY-SA-4.0",
  "composition_license": "public-domain",
  "bpm": 92,
  "time": "3/4",
  "key": "G",
  "bars": [
    {
      "RH": "r:2 D5:4@1",
      "LH": "r:2.",
      "DRUMS": "C2F#2:4 F#2:4 D2F#2:4"
    },
    {
      "RH": "D5:4.@3 C5:8@2 B4:4@1",
      "LH": "G2:4@5 B2D3:4@31 B2D3:4@31",
      "DRUMS": "C2F#2:4 F#2:4 D2F#2:4"
    },
    {
      "RH": "C5:4@1 D5:4@2 C5:4@1",
      "LH": "C3:4@5 E3G3:4@31 E3G3:4@31",
      "DRUMS": "C2F#2:4 F#2:4 D2F#2:4"
    },
    {
      "RH": "B4:4.@3 A4:8@2 G4:4@1",
      "LH": "G2:4@5 B2D3:4@31 B2D3:4@31",
      "DRUMS": "C2F#2:4 F#2:4 D2F#2:4"
    },
    {
      "RH": "F#4:4@3 D4:4.@1 r:8",
      "LH": "D2:4@5 C3F#3:4@41 C3F#3:4@41",
      "DRUMS": "C2F#2:4 F#2:4 D2F#2:4"
    },
    {
      "RH": "G4:4@1 G4:4@1 G4:4@1",
      "LH": "G2:4@5 B2D3:4@31 B2D3:4@31",
      "DRUMS": "C2F#2:4 F#2:4 D2F#2:4"
    },
    {
      "RH": "A4:4@1 B4:4@2 C5:4@3",
      "LH": "D2:4@5 C3F#3:4@41 C3F#3:4@41",
      "DRUMS": "C2F#2:4 F#2:4 D2F#2:4"
    },
    {
      "RH": "B4:4@3 A4:4@2 G4:4@1",
      "LH": "G2:4@5 B2D3:4@31 B2D3:4@31",
      "DRUMS": "C2F#2:4 F#2:4 D2F#2:4"
    },
    {
      "RH": "A4:4.@1 r:8 D5:4@4",
      "LH": "D2:4@5 C3F#3:4@41 C3F#3:4@41",
      "DRUMS": "C2F#2:4 F#2:4 D2F#2:4"
    },
    {
      "RH": "D5:4.@3 C5:8@2 B4:4@1",
      "LH": "G2:4@5 B2D3:4@31 B2D3:4@31",
      "DRUMS": "C2F#2:4 F#2:4 D2F#2:4"
    },
    {
      "RH": "C5:4@1 D5:4@2 C5:4@1",
      "LH": "C3:4@5 E3G3:4@31 E3G3:4@31",
      "DRUMS": "C2F#2:4 F#2:4 D2F#2:4"
    },
    {
      "RH": "B4:4.@3 A4:8@2 G4:4@1",
      "LH": "E3:4@5 G3B3:4@31 G3B3:4@31",
      "DRUMS": "C2F#2:4 F#2:4 D2F#2:4"
    },
    {
      "RH": "F#4:4@3 D4:4.@1 r:8",
      "LH": "D2:4@5 C3F#3:4@41 C3F#3:4@41",
      "DRUMS": "C2F#2:4 F#2:4 D2F#2:4"
    },
    {
      "RH": "G4:4@1 G4:4@1 G4:4@1",
      "LH": "G2:4@5 B2D3:4@31 B2D3:4@31",
      "DRUMS": "C2F#2:4 F#2:4 D2F#2:4"
    },
    {
      "RH": "A4:4@1 B4:4@2 C5:4@3",
      "LH": "D2:4@5 C3F#3:4@41 C3F#3:4@41",
      "DRUMS": "C2F#2:4 F#2:4 D2F#2:4"
    },
    {
      "RH": "B4:4@4 F#4:4@1 A4:4@3",
      "LH": "D3:4@5 F#3A3:4@31 F#3A3:4@31",
      "DRUMS": "C2F#2:4 F#2:4 D2F#2:4"
    },
    {
      "RH": "G4:2.@1",
      "LH": "G2:2.@5",
      "DRUMS": "C2C#3:2."
    }
  ],
  "critical": [
    [
      9,
      15
    ]
  ]
}