{
  "id": "i4-g-chords",
  "title": "Chords in G",
  "composer": "Easy Piano contributors",
  "arranger": "Easy Piano contributors",
  "source": "original",
  "source_url": null,
  "license": "CC-BY-SA-4.0",
  "composition_license": "CC-BY-SA-4.0",
  "bpm": 76,
  "time": "4/4",
  "key": "G",
  "bars": [
    {
      "RH": "G4:4@1 B4:4@3 D5:2@5",
      "LH": "G2B2D3:2@531 G2B2D3:2@531"
    },
    {
      "RH": "B4:4@3 A4:4@2 G4:2@1",
      "LH": "G2B2D3:2@531 G2B2D3:2@531"
    },
    {
      "RH": "C5:4@4 B4:4@3 A4:2@2",
      "LH": "G2C3E3:2@521 G2C3E3:2@521"
    },
    {
      "RH": "B4:4@3 A4:4@2 G4:2@1",
      "LH": "G2B2D3:2@531 G2B2D3:2@531"
    },
    {
      "RH": "D5:4@5 D5:4@5 B4:2@3",
      "LH": "G2B2D3:2@531 G2B2D3:2@531"
    },
    {
      "RH": "C5:4@4 C5:4@4 A4:2@2",
      "LH": "G2C3E3:2@521 G2C3E3:2@521"
    },
    {
      "RH": "A4:2@2 C5:2@4",
      "LH": "A2C3D3F#3:2@5321 A2C3D3F#3:2@5321"
    },
    {
      "RH": "G4:1@1",
      "LH": "G2B2D3:2@531 G2B2D3:2@531"
    },
    {
      "RH": "C5:4@4 D5:4@5 B4:2@3",
      "LH": "G2C3E3:2@521 G2C3E3:2@521"
    },
    {
      "RH": "D5:4@5 B4:4@3 G4:2@1",
      "LH": "G2B2D3:2@531 G2B2D3:2@531"
    },
    {
      "RH": "A4:4@2 C5:4@4 A4:2@2",
      "LH": "A2C3D3F#3:2@5321 A2C3D3F#3:2@5321"
    },
    {
      "RH": "B4:4@3 G4:4@1 B4:2@3",
      "LH": "G2B2D3:2@531 G2B2D3:2@531"
    },
    {
      "RH": "D5:2@5 B4:2@3",
      "LH": "G2B2D3:2@531 G2B2D3:2@531"
    },
    {
      "RH": "C5:4@4 B4:4@3 A4:2@2",
      "LH": "G2C3E3:2@521 G2C3E3:2@521"
    },
    {
      "RH": "A4:2@2 C5:2@4",
      "LH": "A2C3D3F#3:2@5321 A2C3D3F#3:2@5321"
    },
    {
      "RH": "G4:1@1",
      "LH": "G2B2D3:1@531"
    }
  ],
  "critical": [
    [
      10,
      12
    ]
  ]
}