{
  "id": "musette-in-d",
  "title": "Musette in D",
  "composer": "Johann Sebastian Bach (attributed)",
  "arranger": "Easy Piano contributors",
  "source": "original",
  "source_url": null,
  "license": "CC-BY-SA-4.0",
  "composition_license": "public-domain",
  "bpm": 92,
  "time": "2/4",
  "key": "D",
  "bars": [
    {
      "RH": "D5:4@1 F#5:4@3",
      "LH": "D3:4@5 A3:4@1"
    },
    {
      "RH": "A5:8@4 G5:8@3 F#5:8@2 E5:8@1",
      "LH": "D3:4@5 A3:4@1"
    },
    {
      "RH": "F#5:4@3 D5:4@1",
      "LH": "D3:4@5 A3:4@1"
    },
    {
      "RH": "E5:8@2 F#5:8@3 E5:8@2 D5:8@1",
      "LH": "G2:4@5 D3:4@1"
    },
    {
      "RH": "E5:4@3 C#5:4@1",
      "LH": "A2:4@5 E3:4@1"
    },
    {
      "RH": "D5:8@1 E5:8@2 F#5:8@3 G5:8@4",
      "LH": "A2:4@5 E3:4@1"
    },
    {
      "RH": "A5:4@3 F#5:4@1",
      "LH": "D3:4@5 A3:4@1"
    },
    {
      "RH": "E5:2@1",
      "LH": "A2:4@5 E3:4@1"
    },
    {
      "RH": "D5:4@1 F#5:4@3",
      "LH": "D3:4@5 A3:4@1"
    },
    {
      "RH": "A5:8@4 G5:8@3 F#5:8@2 E5:8@1",
      "LH": "D3:4@5 A3:4@1"
    },
    {
      "RH": "F#5:4@3 D5:4@1",
      "LH": "D3:4@5 A3:4@1"
    },
    {
      "RH": "E5:8@1 F#5:8@2 G5:8@3 E5:8@1",
      "LH": "A2:4@5 E3:4@1"
    },
    {
      "RH": "F#5:8@4 E5:8@3 D5:8@2 C#5:8@1",
      "LH": "A2:4@5 E3:4@1"
    },
    {
      "RH": "B4:4@1 D5:4@3",
      "LH": "G2:4@5 D3:4@1"
    },
    {
      "RH": "E5:4@3 C#5:4@1",
      "LH": "A2:4@5 E3:4@1"
    },
    {
      "RH": "D5:2@1",
      "LH": "D3F#3A3:2@531"
    }
  ],
  "critical": [
    [
      4,
      7
    ]
  ]
}