{
  "id": "hallelujah-chorus",
  "title": "Hallelujah Chorus",
  "composer": "George Frideric Handel",
  "arranger": "Easy Piano contributors",
  "source": "original",
  "source_url": null,
  "license": "CC-BY-SA-4.0",
  "composition_license": "public-domain",
  "bpm": 92,
  "time": "4/4",
  "key": "D",
  "bars": [
    {
      "RH": "D5:4.@4 A4:8@1 B4:8@2 A4:8@1 r:4",
      "LH": "D2:2@5 A2:2@1",
      "PAD": "D3F#3A3:1"
    },
    {
      "RH": "D5:4.@4 A4:8@1 B4:8@2 A4:8@1 r:8 D5:16@4 D5:16@4",
      "LH": "D2:2@5 A2:2@1",
      "PAD": "D3F#3A3:1"
    },
    {
      "RH": "D5:8@4 D5:8@4 r:8 D5:16@4 D5:16@4 D5:8@4 D5:8@4 r:8 D5:8@4",
      "LH": "D2:2@5 A2:2@1",
      "PAD": "D3F#3A3:1"
    },
    {
      "RH": "C#5:8@3 D5:4@4 C#5:8@3 D5:4@4 r:4",
      "LH": "A2:2@5 E3:2@1",
      "PAD": "C#3E3A3:1"
    },
    {
      "RH": "E5:4.@4 A4:8@1 F#5:8@5 E5:8@4 r:4",
      "LH": "A2:2@5 E3:2@1",
      "PAD": "C#3E3A3:1"
    },
    {
      "RH": "E5:4.@4 A4:8@1 F#5:8@5 E5:8@4 r:8 E5:16@4 E5:16@4",
      "LH": "A2:2@5 E3:2@1",
      "PAD": "C#3E3A3:1"
    },
    {
      "RH": "F#5:8@5 E5:8@4 r:8 E5:16@4 E5:16@4 F#5:8@5 E5:8@4 r:8 E5:8@4",
      "LH": "A2:2@5 E3:2@1",
      "PAD": "C#3E3A3:1"
    },
    {
      "RH": "F#5:8@5 E5:8@4 D5:4@3 C#5:4@2 r:4",
      "LH": "D2:2@5 A2:2@1",
      "PAD": "D3F#3A3:1"
    },
    {
      "RH": "A4:2@1 B4:4@2 C#5:4@3",
      "LH": "A2:2@5 E3:2@1",
      "PAD": "C#3E3A3:1"
    },
    {
      "RH": "D5:8@4 D4:8@1 D5:4.@4 D5:8@4 C#5:4@3",
      "LH": "D2:2@5 A2:2@1",
      "PAD": "D3F#3A3:1"
    },
    {
      "RH": "B4:2@2 A4:4@1 r:8 E5:16@4 E5:16@4",
      "LH": "G2:2@5 D3:2@1",
      "PAD": "D3G3B3:1"
    },
    {
      "RH": "D5:8@4 C#5:8@3 r:8 E5:16@5 E5:16@5 D5:8@4 C#5:8@3 r:8 E5:16@5 E5:16@5",
      "LH": "A2:2@5 E3:2@1",
      "PAD": "C#3E3A3:1"
    },
    {
      "RH": "F#5:8@5 E5:8@4 r:8 E5:16@4 E5:16@4 F#5:8@5 E5:8@4 r:4",
      "LH": "D2:2@5 A2:2@1",
      "PAD": "D3F#3A3:1"
    },
    {
      "RH": "r:2. A4:4@1",
      "LH": "D2:2@5 A2:2@1",
      "PAD": "D3F#3A3:1"
    },
    {
      "RH": "A4:4@5 G4:4@4 F#4:4@3 E4:8.@2 D4:16@1",
      "LH": "D2:2@5 A2:2@1",
      "PAD": "D3F#3A3:1"
    },
    {
      "RH": "D4:1@1",
      "LH": "D3:1@2",
      "PAD": "D3F#3A3:1"
    },
    {
      "RH": "r:2 F#4:4@3 E4:8.@2 D4:16@1",
      "LH": "D2:2@5 A2:2@1",
      "PAD": "D3F#3A3:1"
    },
    {
      "RH": "D4:2.@1 F#5:4@5",
      "LH": "D2:2@5 A2:2@1",
      "PAD": "D3F#3A3:1"
    },
    {
      "RH": "E5:4@4 D5:4@3 D5:4@3 C#5:4@2",
      "LH": "A2:2@5 E3:2@1",
      "PAD": "C#3E3A3:1"
    },
    {
      "RH": "D5:4.@3 C#5:8@2 D5:4@3 D5:4@3",
      "LH": "D2:2@5 A2:2@1",
      "PAD": "D3F#3A3:1"
    },
    {
      "RH": "C#5:4.@3 A4:8@1 B4:4@2 C#5:4@3",
      "LH": "A2:2@5 E3:2@1",
      "PAD": "C#3E3A3:1"
    },
    {
      "RH": "D5:2@3 r:2",
      "LH": "D2:2@5 A2:2@1",
      "PAD": "D3F#3A3:1"
    },
    {
      "RH": "D5:8@3 D5:8@3 r:8 D5:16@3 D5:16@3 D5:8@3 D5:8@3 r:4",
      "LH": "D2:2@5 A2:2@1",
      "PAD": "D3F#3A3:1"
    },
    {
      "RH": "D5:1@3",
      "LH": "D2:1@5",
      "PAD": "D3F#3A3:1"
    }
  ],
  "critical": [
    [
      8,
      12
    ]
  ]
}
