{
  "id": "b1-motion-drill",
  "title": "Together and Apart",
  "composer": "Easy Piano contributors",
  "arranger": "Easy Piano contributors",
  "source": "original",
  "source_url": null,
  "license": "CC-BY-SA-4.0",
  "composition_license": "CC-BY-SA-4.0",
  "bpm": 72,
  "time": "4/4",
  "key": "G",
  "bars": [
    {
      "RH": "B4:4@1 C5:4@2 D5:4@3 E5:4@4",
      "LH": "G3:4@5 A3:4@4 B3:4@3 C4:4@2"
    },
    {
      "RH": "D5:4@4 C5:4@3 B4:4@2 A4:4@1",
      "LH": "B3:4@2 A3:4@3 G3:4@4 F#3:4@5"
    },
    {
      "RH": "G4:4@1 A4:4@2 B4:4@3 C5:4@4",
      "LH": "G3:4@2 F#3:4@3 E3:4@4 D3:4@5"
    },
    {
      "RH": "D5:4@4 C5:4@3 B4:4@2 A4:4@1",
      "LH": "D3:4@5 E3:4@4 F#3:4@3 G3:4@2"
    },
    {
      "RH": "D4:4@1 E4:4@2 F#4:4@3 G4:4@4",
      "LH": "D3:4@5 E3:4@4 F#3:4@3 G3:4@2"
    },
    {
      "RH": "G4:4@4 F#4:4@3 E4:4@2 D4:4@1",
      "LH": "D3:4@5 E3:4@4 F#3:4@3 G3:4@2"
    },
    {
      "RH": "B4:4@4 A4:4@3 G4:4@2 F#4:4@1",
      "LH": "G3:4@5 A3:4@4 B3:4@3 D4:4@1"
    },
    {
      "RH": "G4:1@3",
      "LH": "G3:1@3"
    }
  ],
  "critical": [
    [
      2,
      5
    ]
  ]
}