{
  "id": "sct-run-drill",
  "title": "Runs in F Sharp Minor",
  "composer": "Easy Piano contributors",
  "arranger": "Easy Piano contributors",
  "source": "original",
  "source_url": null,
  "license": "CC-BY-SA-4.0",
  "composition_license": "CC-BY-SA-4.0",
  "bpm": 76,
  "time": "2/4",
  "key": "A",
  "bars": [
    {
      "RH": "A5:16@3 B5:16@4 A5:16@3 G#5:16@2 F#5:16@1 A5:16@3 G#5:16@2 F#5:16@1",
      "LH": "F#3:8@5 A3C#4:8@51 A3C#4:8@51 A3C#4:8@51"
    },
    {
      "RH": "E#5:16@3 F#5:16@4 G#5:16@5 E#5:16@3 C#5:16@1 D#5:16@2 E#5:16@3 C#5:16@1",
      "LH": "G#3:8@4 B3C#4:8@51 B3C#4:8@51 B3C#4:8@51"
    },
    {
      "RH": "F#5:16@2 E#5:16@1 F#5:16@2 G#5:16@3 A5:16@4 G#5:16@3 A5:16@4 B5:16@5",
      "LH": "F#3:8@5 A3C#4:8@51 A3C#4:8@51 A3C#4:8@51"
    },
    {
      "RH": "G#5:16@3 F#5:16@2 E#5:16@1 F#5:16@2 G#5:8@3 E#5:8@1",
      "LH": "E#3:8@5 G#3C#4:8@51 G#3C#4:8@51 G#3C#4:8@51"
    },
    {
      "RH": "C#5:16@1 D#5:16@2 E#5:16@3 F#5:16@4 G#5:16@5 A5:16@5 B5:16@5 C#6:16@5",
      "LH": "F#3:8@5 A3C#4:8@51 A3C#4:8@51 A3C#4:8@51"
    },
    {
      "RH": "C#6:16@5 B5:16@5 A5:16@5 G#5:16@5 F#5:16@4 E#5:16@3 D#5:16@2 C#5:16@1",
      "LH": "C#3:8@5 E#3G#3:8@51 E#3G#3:8@51 E#3G#3:8@51"
    },
    {
      "RH": "D#5:16@3 E#5:16@4 F#5:16@5 D#5:16@3 B#4:16@1 C#5:16@2 D#5:16@3 B#4:16@1",
      "LH": "G#3:8@5 D#4F#4:8@51 D#4F#4:8@51 D#4F#4:8@51"
    },
    {
      "RH": "C#5:2@1",
      "LH": "C#3:2@1"
    }
  ],
  "critical": [
    [
      1,
      6
    ]
  ]
}