{
  "id": "i4-g-scale",
  "title": "G Major Scale",
  "composer": "Easy Piano contributors",
  "arranger": "Easy Piano contributors",
  "source": "original",
  "source_url": null,
  "license": "CC-BY-SA-4.0",
  "composition_license": "CC-BY-SA-4.0",
  "bpm": 72,
  "time": "4/4",
  "key": "G",
  "bars": [
    {
      "RH": "G4:4@1 A4:4@2 B4:4@3 C5:4@1",
      "LH": "r:1"
    },
    {
      "RH": "D5:4@2 E5:4@3 F#5:4@4 G5:4@5",
      "LH": "r:1"
    },
    {
      "RH": "G5:4@5 F#5:4@4 E5:4@3 D5:4@2",
      "LH": "r:1"
    },
    {
      "RH": "C5:4@1 B4:4@3 A4:4@2 G4:4@1",
      "LH": "r:1"
    },
    {
      "RH": "r:1",
      "LH": "G2:4@5 A2:4@4 B2:4@3 C3:4@2"
    },
    {
      "RH": "r:1",
      "LH": "D3:4@1 E3:4@3 F#3:4@2 G3:4@1"
    },
    {
      "RH": "G4:4@1 A4:4@2 B4:4@3 D5:4@5",
      "LH": "G2:2@5 D3:2@1"
    },
    {
      "RH": "B4D5G5:1@135",
      "LH": "G2:1@5"
    }
  ],
  "critical": [
    [
      0,
      4
    ]
  ]
}