{
  "id": "mikrokosmos-001",
  "title": "Mikrokosmos 1: Six Unison Melodies, no. 1",
  "composer": "Béla Bartók",
  "arranger": "Béla Bartók; MusicXML by Pedro Ramoneda (Mikrokosmos-difficulty)",
  "source": "Mikrokosmos-difficulty",
  "source_url": "https://github.com/PRamoneda/Mikrokosmos-difficulty/blob/main/musicxml/1.xml",
  "license": "public-domain",
  "composition_license": "public-domain",
  "restricted_in": [
    {
      "region": "US",
      "until": "2036-01-01"
    }
  ],
  "bpm": 96,
  "time": "4/4",
  "key": "C",
  "bars": [
    {
      "RH": "C5:2 D5:2",
      "LH": "C3:2 D3:2"
    },
    {
      "RH": "E5:1",
      "LH": "E3:1"
    },
    {
      "RH": "F5:2 E5:2",
      "LH": "F3:2 E3:2"
    },
    {
      "RH": "D5:2 r:2",
      "LH": "D3:2 r:2"
    },
    {
      "RH": "E5:2 F5:2",
      "LH": "E3:2 F3:2"
    },
    {
      "RH": "G5:2 F5:2",
      "LH": "G3:2 F3:2"
    },
    {
      "RH": "E5:2 D5:2",
      "LH": "E3:2 D3:2"
    },
    {
      "RH": "C5:1",
      "LH": "C3:1"
    }
  ]
}
