{
  "id": "b2-g-minor-drill",
  "title": "Three Flats Down",
  "composer": "Easy Piano contributors",
  "arranger": "Easy Piano contributors",
  "source": "original",
  "source_url": null,
  "license": "CC-BY-SA-4.0",
  "composition_license": "CC-BY-SA-4.0",
  "bpm": 76,
  "time": "4/4",
  "key": "Gm",
  "bars": [
    {
      "RH": "G4:4@1 A4:4@2 Bb4:4@3 C5:4@4",
      "LH": "G2:1@1"
    },
    {
      "RH": "D5:4@2 Eb5:4@3 D5:4@2 C5:4@1",
      "LH": "C3:1@1"
    },
    {
      "RH": "Bb4:4@4 A4:4@3 G4:4@2 F#4:4@1",
      "LH": "D3:1@1"
    },
    {
      "RH": "G4:2@4 D4:2@1",
      "LH": "G2:1@1"
    },
    {
      "RH": "Bb4:4@1 D5:4@3 G5:4@5 D5:4@3",
      "LH": "Eb3:1@1"
    },
    {
      "RH": "Eb5:4@5 C5:4@5 A4:4@3 F#4:4@1",
      "LH": "C3:1@1"
    },
    {
      "RH": "G4:4@1 A4:4@2 Bb4:4@3 A4:4@2",
      "LH": "D3:1@1"
    },
    {
      "RH": "G4:1@1",
      "LH": "G2:1@1"
    }
  ]
}