{
  "id": "pc3-d-inversions",
  "title": "Smooth in D",
  "composer": "Easy Piano contributors",
  "arranger": "Easy Piano contributors",
  "source": "original",
  "source_url": null,
  "license": "CC-BY-SA-4.0",
  "composition_license": "CC-BY-SA-4.0",
  "bpm": 88,
  "time": "4/4",
  "key": "D",
  "bars": [
    {
      "RH": "A4:8@3 A4:8@3 B4:8@4 A4:8@3 F#4:4@1 D4:4@1",
      "LH": "D3F#3A3:2@531 D3F#3A3:2@531",
      "DRUMS": "C2F#2:8 F#2:8 D2F#2:8 F#2:8 C2F#2:8 C2F#2:8 D2F#2:8 F#2:8",
      "BASS": "D2:4 A2:4 D2:4 A2:4"
    },
    {
      "RH": "C#5:4@3 B4:8@2 A4:8@1 E4:2@1",
      "LH": "C#3E3A3:2@531 C#3E3A3:2@531",
      "DRUMS": "C2F#2:8 F#2:8 D2F#2:8 F#2:8 C2F#2:8 C2F#2:8 D2F#2:8 F#2:8",
      "BASS": "A1:4 E2:4 A1:4 E2:4"
    },
    {
      "RH": "D5:4@3 D5:8@3 B4:8@1 F#4:2@1",
      "LH": "D3F#3B3:2@531 D3F#3B3:2@531",
      "DRUMS": "C2F#2:8 F#2:8 D2F#2:8 F#2:8 C2F#2:8 C2F#2:8 D2F#2:8 F#2:8",
      "BASS": "B1:4 F#2:4 B1:4 F#2:4"
    },
    {
      "RH": "G4:4@2 B4:8@4 D5:8@5 B4:4@3 G4:4@1",
      "LH": "D3G3B3:2@521 D3G3B3:2@521",
      "DRUMS": "C2F#2:8 F#2:8 D2F#2:8 F#2:8 C2F#2:8 C2F#2:8 D2F#2:8 F#2:8",
      "BASS": "G1:4 D2:4 G1:4 D2:4"
    },
    {
      "RH": "A4:8@2 A4:8@2 B4:8@3 A4:8@2 F#4:4@1 A4:4@3",
      "LH": "D3F#3A3:2@531 D3F#3A3:2@531",
      "DRUMS": "C2F#2:8 F#2:8 D2F#2:8 F#2:8 C2F#2:8 C2F#2:8 D2F#2:8 F#2:8",
      "BASS": "D2:4 A2:4 D2:4 A2:4"
    },
    {
      "RH": "C#5:8@5 C#5:8@5 B4:8@4 A4:8@3 E5:2@5",
      "LH": "C#3E3A3:2@531 C#3E3A3:2@531",
      "DRUMS": "C2F#2:8 F#2:8 D2F#2:8 F#2:8 C2F#2:8 C2F#2:8 D2F#2:8 F#2:8",
      "BASS": "A1:4 E2:4 A1:4 E2:4"
    },
    {
      "RH": "D5:4@4 B4:4@2 A4:8@1 B4:8@2 D5:4@4",
      "LH": "D3F#3B3:2@531 D3F#3B3:2@531",
      "DRUMS": "C2F#2:8 F#2:8 D2F#2:8 F#2:8 C2F#2:8 C2F#2:8 D2F#2:8 F#2:8",
      "BASS": "B1:4 F#2:4 B1:4 F#2:4"
    },
    {
      "RH": "B4:4@2 G4:4@4 D4:2@1",
      "LH": "D3G3B3:2@521 D3G3B3:2@521",
      "DRUMS": "C2F#2:8 F#2:8 D2F#2:8 F#2:8 C2F#2:8 C2F#2:8 D2F#2:8 F#2:8",
      "BASS": "G1:4 D2:4 G1:4 D2:4"
    },
    {
      "RH": "G4:4@4 B4:4@1 D5:4@3 G5:4@2",
      "LH": "D3G3B3:4@521 D3G3B3:4@521 D3G3B3:4@521 D3G3B3:4@521",
      "DRUMS": "C2F#2:8 F#2:8 D2F#2:8 F#2:8 C2F#2:8 C2F#2:8 D2F#2:8 F#2:8",
      "BASS": "G1:4 D2:4 G1:4 D2:4"
    },
    {
      "RH": "F#5:4@1 A4:4@2 D5:2@5",
      "LH": "D3F#3A3:4@531 D3F#3A3:4@531 D3F#3A3:4@531 D3F#3A3:4@531",
      "DRUMS": "C2F#2:8 F#2:8 D2F#2:8 F#2:8 C2F#2:8 C2F#2:8 D2F#2:8 F#2:8",
      "BASS": "D2:4 A2:4 D2:4 A2:4"
    },
    {
      "RH": "D5:4@5 B4:4@3 G4:4@1 B4:4@3",
      "LH": "D3G3B3:4@521 D3G3B3:4@521 D3G3B3:4@521 D3G3B3:4@521",
      "DRUMS": "C2F#2:8 F#2:8 D2F#2:8 F#2:8 C2F#2:8 C2F#2:8 D2F#2:8 F#2:8",
      "BASS": "G1:4 D2:4 G1:4 D2:4"
    },
    {
      "RH": "A4:4@2 C#5:4@4 E5:2@4",
      "LH": "C#3E3A3:4@531 C#3E3A3:4@531 C#3E3A3:4@531 C#3E3A3:4@531",
      "DRUMS": "C2F#2:8 F#2:8 D2F#2:8 F#2:8 C2F#2:8 C2F#2:8 D2F#2:8 F#2:8",
      "BASS": "A1:4 E2:4 A1:4 E2:4"
    },
    {
      "RH": "F#5:4@5 D5:4@3 B4:4@1 D5:4@3",
      "LH": "D3F#3B3:4@531 D3F#3B3:4@531 D3F#3B3:4@531 D3F#3B3:4@531",
      "DRUMS": "C2F#2:8 F#2:8 D2F#2:8 F#2:8 C2F#2:8 C2F#2:8 D2F#2:8 F#2:8",
      "BASS": "B1:4 F#2:4 B1:4 F#2:4"
    },
    {
      "RH": "D5:8@3 D5:8@3 B4:8@1 G4:8@1 B4:2@3",
      "LH": "D3G3B3:4@521 D3G3B3:4@521 D3G3B3:4@521 D3G3B3:4@521",
      "DRUMS": "C2F#2:8 F#2:8 D2F#2:8 F#2:8 C2F#2:8 C2F#2:8 D2F#2:8 F#2:8",
      "BASS": "G1:4 D2:4 G1:4 D2:4"
    },
    {
      "RH": "A4:4@2 B4:4@3 C#5:4@4 E5:4@2",
      "LH": "C#3E3A3:4@531 C#3E3A3:4@531 C#3E3A3:4@531 C#3E3A3:4@531",
      "DRUMS": "C2F#2:8 F#2:8 D2F#2:8 F#2:8 C2F#2:8 C2F#2:8 D2F#2:8 F#2:8",
      "BASS": "A1:4 E2:4 A1:4 E2:4"
    },
    {
      "RH": "D5:1@1",
      "LH": "D3F#3A3:1@531",
      "DRUMS": "C2C#3:1",
      "BASS": "D2:1"
    }
  ],
  "critical": [
    [
      8,
      12
    ]
  ]
}
